{
  "carrier": "Ocean Network Express",
  "seaWaybillNumber": "ONEYHKGCJ3680701",
  "bookingNumber": "HKGCJ3680701",
  "shipperName": "HECNY SHIPPING LTD.",
  "shipperAddress": "7/F, HECNY CARGO BLDG, 111 WAI YIP STREET KWUN TONG, KLN., HONG KONG",
  "consigneeName": "VINCE LLC",
  "consigneeAddress": "900 N CAHUENGA BLVD. LOS ANGELEA, CA 90038, USA",
  "notifyPartyName": "HECNY TRANSPORTATION INC.",
  "vesselVoyage": "COSCO SPAIN 055E",
  "placeOfReceipt": "HONG KONG, HONG KONG",
  "portOfLoading": "HONG KONG",
  "portOfDischarge": "LONG BEACH, CA",
  "placeOfDelivery": "LONG BEACH",
  "typeOfMovement": "FCL / FCL CY / CY",
  "containerNumber": "KKTU8245698",
  "sealNumber": "HKA130375",
  "containerType": "20GP",
  "cartonsTotal": 241.0,
  "grossWeightKg": 2539.0,
  "grossMeasurementCbm": 22.52,
  "freightTerms": "OCEAN FREIGHT COLLECT",
  "serviceContractNumber": "LAX0056B22",
  "placeOfIssue": "SHENZHEN",
  "dateLadenOnBoard": "2023-01-25",
  "dateIssued": "2023-01-25",
  "cargoItems": [
    {
      "goodsDescription": "LADIES' 90% COTTON 10% SPANDEX KNITTED DRESS LADIES' 54% COTTON 45% NYLON 1% SPANDEX KNITTED PULLOVER LADIES' 54% COTTON 45% NYLON 1% SPANDEX KNITTED SKIRTS",
      "hsCode": "610442, 611020, 610452",
      "cartons": 77.0,
      "measurementCbm": 6.55,
      "weightKg": 537.0
    },
    {
      "goodsDescription": "LADIES' 90% COTTON 10% SPANDEX KNITTED DRESS LADIES' 54% COTTON 45% NYLON 1% SPANDEX KNITTED PULLOVER LADIES' 54% COTTON 45% NYLON 1% SPANDEX KNITTED SKIRTS",
      "hsCode": "610442, 611020, 610452",
      "cartons": 92.0,
      "measurementCbm": 8.01,
      "weightKg": 1008.0
    },
    {
      "goodsDescription": "59% LYOCELL 27% COTTON 14% LINEN MEN'S WOVEN SHORT",
      "hsCode": "620349",
      "cartons": 17.0,
      "measurementCbm": 1.23,
      "weightKg": 213.0
    },
    {
      "goodsDescription": "80% RAYON 20% NYLON WOMEN'S WOVEN SHIRT",
      "hsCode": "620640",
      "cartons": 8.0,
      "measurementCbm": 1.41,
      "weightKg": 82.0
    },
    {
      "goodsDescription": "62% COTTON 38% VISCOSE. - WOMEN'S WOVEN OUTWEAR",
      "hsCode": "620630",
      "cartons": 42.0,
      "measurementCbm": 4.59,
      "weightKg": 626.0
    },
    {
      "goodsDescription": "LADIES' 58% LINEN 39% COTTON 3% ELASTANE WOVEN TOP",
      "hsCode": "620690",
      "cartons": 5.0,
      "measurementCbm": 0.73,
      "weightKg": 73.0
    }
  ]
}
